{
  "schema_version": 2,
  "response_id": "00000000-0000-0000-0000-000000000004",
  "source_request_hash": "sha256:bae7cca0b02dd1e8ef27750a9ebff2a4e2bf58784b42238fbe7b49aa693ab3ee",
  "evidence": {
    "schema_version": 2,
    "evidence_id": "00000000-0000-0000-0000-000000000001",
    "task_hash": "sha256:0101010101010101010101010101010101010101010101010101010101010101",
    "trace_id": "00000000-0000-0000-0000-000000000002",
    "ledger_hash": "sha256:0202020202020202020202020202020202020202020202020202020202020202",
    "sequence": 0,
    "parent_evidence_hash": null,
    "requirement_hash": "sha256:0303030303030303030303030303030303030303030303030303030303030303",
    "stage": "REQUEST",
    "subject_hash": "sha256:bfc4f2cf581d199a87b91bf1b63b6c8ff029e07568a8356a575e7d1a10c6f3a7",
    "transformation_step_hash": null,
    "verdict": "SUPPORTS",
    "confidence": { "lower": 950000, "estimate": 975000, "upper": 1000000 },
    "method_kind": "DETERMINISTIC_CHECK",
    "method_hash": "sha256:0505050505050505050505050505050505050505050505050505050505050505",
    "evaluator_hash": "sha256:0606060606060606060606060606060606060606060606060606060606060606",
    "calibration_status": "NOT_APPLICABLE",
    "calibration_hash": null,
    "payload_hash": "sha256:0707070707070707070707070707070707070707070707070707070707070707",
    "observed_at": 1100
  },
  "evidence_hash": "sha256:ca560578957d04a3c3e1372126fc2b97a3f689385996bb7acff17a6c62ef911c",
  "provenance_hash": "sha256:5f65c4ed8bac43c655330da63775bf56972c0b184dd66e1528eab6bd58d47166",
  "calibration_status": "NOT_APPLICABLE",
  "calibration_hash": null,
  "body_hash": "sha256:30f8cc7908e69e16983b226e0648fdea00ffc2d731a252dba2f96190775e2f13",
  "responded_at": 1200,
  "authentication": { "mode": "LOCAL" }
}
